{"$schema":"https://json-schema.org/draft/2020-12/schema","$defs":{"id":{"type":"string","pattern":"^[a-z0-9][a-z0-9-]*$","minLength":3},"sourceIds":{"type":"array","items":{"type":"string","minLength":3},"minItems":1,"uniqueItems":true},"contentStatus":{"enum":["planned","draft","machine-assisted","human-reviewed","production-ready","fixture"]},"translationReviewStatus":{"enum":["draft","machine-assisted","human-reviewed"]},"ref":{"type":"object","required":["id","path"],"properties":{"id":{"$ref":"#/$defs/id"},"path":{"type":"string","minLength":3}},"additionalProperties":false},"reviewMetadata":{"type":"object","required":["reviewStage","reviewReason"],"properties":{"firstIntroducedIn":{"type":["string","null"]},"reviewStage":{"type":"integer","minimum":1},"reviewReason":{"type":"string","minLength":3},"previousExerciseId":{"type":["string","null"]}},"additionalProperties":false}},"title":"HSK level","type":"object","required":["recordType","id","syllabusVersion","stage","level","titleZh","titleVi","objectives","topics","unitRefs","lessonIndex","assessmentRefs","finalAssessmentId","sourceIds","contentStatus","translationReviewStatus","productionReady","contentVersion"],"properties":{"recordType":{"const":"level"},"id":{"$ref":"#/$defs/id"},"syllabusVersion":{"type":"string","minLength":3},"examBlueprintVersion":{"type":"string"},"stage":{"enum":["elementary","intermediate","advanced"]},"level":{"type":"integer","minimum":1,"maximum":9},"titleZh":{"type":"string","minLength":1},"titleVi":{"type":"string","minLength":1},"objectives":{"type":"array","items":{"type":"string"}},"topics":{"type":"array","items":{"type":"string"}},"unitRefs":{"type":"array","items":{"$ref":"#/$defs/ref"}},"lessonIndex":{"type":"array","items":{"type":"object","required":["id","unitId","path"],"properties":{"id":{"$ref":"#/$defs/id"},"unitId":{"$ref":"#/$defs/id"},"path":{"type":"string","minLength":3}},"additionalProperties":false}},"assessmentRefs":{"type":"array","items":{"$ref":"#/$defs/ref"}},"sourceIds":{"$ref":"#/$defs/sourceIds"},"contentStatus":{"$ref":"#/$defs/contentStatus"},"translationReviewStatus":{"$ref":"#/$defs/translationReviewStatus"},"productionReady":{"type":"boolean"},"contentVersion":{"type":"integer","minimum":1},"finalAssessmentId":{"type":["string","null"]}},"additionalProperties":false}