{
  "recordType": "level",
  "id": "hsk7",
  "syllabusVersion": "GF0025-2021",
  "examBlueprintVersion": "CTI-HSK3.0-2026",
  "stage": "advanced",
  "level": 7,
  "titleZh": "HSK 7",
  "titleVi": "HSK 7",
  "objectives": [],
  "topics": [],
  "unitRefs": [],
  "lessonIndex": [],
  "assessmentRefs": [],
  "sourceIds": ["moe-gf0025-2021-standard","cti-hsk3-current-syllabus-2026"],
  "contentStatus": "planned",
  "translationReviewStatus": "draft",
  "productionReady": false,
  "contentVersion": 1,
  "finalAssessmentId": null
}
